{"$schema":"./session-input.schema.json","artifact_type":"DEVELOPMENT_ELICITATION_SCRIPT_INPUT","instrument_binding":{"content_sha256":"52705bc686a69d43360eb0544eda59571c77dc1e29520ec4b156bcd60f413776","instrument_id":"INTERP-DIALOGUE-001P0-ELICITATION-INSTRUMENT-V0","instrument_version":"0.0.0"},"run_id":"P1V0-RUN-0014","schema_version":"1.0.0","sessions":[{"comparison_binding":{"status":"NOT_APPLICABLE"},"future_option_id":"FUTURE-WORK-1","presentation_id":"PRES-WORK-010-EN-V0","responses":{"immediate":{"raw_payload_record":{"byte_length":54,"content_sha256":"be37d8543d75adaa87aa292f6d7507994d6bbd08676c34ab7bd501264aeec89e","encoding":"BASE64_OF_EXACT_UTF8_BYTES","normalization":"NONE","raw_payload_utf8_base64":"VGhleSB3b3VsZCBzYXk6ICJJIHVuZGVyc3RhbmQuIg0KVGhlbiB0aGV5IHdvdWxkIHdhaXQu","status":"PRESENT"},"response_status":"RESPONDED"},"later":{"raw_payload_record":{"byte_length":122,"content_sha256":"a3e6c508ddd04474eddc507d88e2600da4964fa1ba80b4bba6f2395dbe9fa0f1","encoding":"BASE64_OF_EXACT_UTF8_BYTES","normalization":"NONE","raw_payload_utf8_base64":"VGhlIHBlcnNvbiB3b3VsZCBub3Qgc2F5IGFueXRoaW5nIGFuZCB3b3VsZCBub3QgZG8gYW55dGhpbmcuIFRoZXkgd291bGQgZGVsaWJlcmF0ZWx5IGxlYXZlIHRoZSBtZXNzYWdlIHVuYW5zd2VyZWQgZm9yIG5vdy4=","status":"PRESENT"},"response_status":"RESPONDED"},"post_trace_diagnostic":{"mode":"OMITTED"}},"session_id":"P1V0-S-0020"}],"source_kind":"SCRIPTED_ADVERSARIAL_RESPONSE"}