{"$schema":"./session-input.schema.json","artifact_type":"DEVELOPMENT_ELICITATION_SCRIPT_INPUT","instrument_binding":{"content_sha256":"52705bc686a69d43360eb0544eda59571c77dc1e29520ec4b156bcd60f413776","instrument_id":"INTERP-DIALOGUE-001P0-ELICITATION-INSTRUMENT-V0","instrument_version":"0.0.0"},"run_id":"P1V0-RUN-0015","schema_version":"1.0.0","sessions":[{"comparison_binding":{"status":"NOT_APPLICABLE"},"future_option_id":"FUTURE-WORK-0","presentation_id":"PRES-WORK-011-EN-V0","responses":{"immediate":{"raw_payload_record":{"byte_length":203,"content_sha256":"ca2c8ffed265b433aa67c84168582cec266485628596018a16feb9818b31f77d","encoding":"BASE64_OF_EXACT_UTF8_BYTES","normalization":"NONE","raw_payload_utf8_base64":"SXQgZGVwZW5kcy4gSWYgdGhleSBsZWFuIG9uIHRoZSBoaXN0b3J5LCB0aGV5IHdvdWxkIHNpbXBseSBhZ3JlZSBhbmQgd2FpdC4gSWYgdGhlIGxvdyBtb29kIGRvbWluYXRlcywgdGhleSBtaWdodCBhc2sgb25lIGNoZWNraW5nIHF1ZXN0aW9uIGZpcnN0LiBCb3RoIGNvbnRpbnVhdGlvbnMgc2VlbSBsaXZlIHRvIG1lIGFuZCBJIGNhbm5vdCBwaWNrIG9uZS4=","status":"PRESENT"},"response_status":"RESPONDED"},"later":{"raw_payload_record":{"byte_length":143,"content_sha256":"2bdeb1ebf3e8ffc4828a766f0e65d472969a44fd8ced6e12eea07859434c8cda","encoding":"BASE64_OF_EXACT_UTF8_BYTES","normalization":"NONE","raw_payload_utf8_base64":"Rmlyc3QsIHRoZXkgd291bGQgcGF1c2UgYW5kIHJlcmVhZCB0aGUgbWVzc2FnZS4KVGhlbiB0aGV5IHdvdWxkIGFuc3dlcjogIlVuZGVyc3Rvb2QuIFRvbW9ycm93LCB0aGVuLiIKQWZ0ZXIgdGhhdCB0aGV5IHdvdWxkIHB1dCB0aGUgcGhvbmUgYXdheS4=","status":"PRESENT"},"response_status":"RESPONDED"},"post_trace_diagnostic":{"mode":"COLLECTED_AFTER_R2","response":{"raw_payload_record":{"byte_length":193,"content_sha256":"3bb066233284b499bda7df9709e05f40a9081f6d7cd51a8c039cc5099eb2dd8f","encoding":"BASE64_OF_EXACT_UTF8_BYTES","normalization":"NONE","raw_payload_utf8_base64":"VGhpbmtpbmcgYmFjaywgSSBwcm9iYWJseSBhbnN3ZXJlZCB0aGF0IHdheSBiZWNhdXNlIHRoZSBwZXJzb24gc2VlbWVkIGluc2VjdXJlIOKAlCB0aG91Z2ggdGhlIHNjZW5hcmlvIG5ldmVyIHNheXMgdGhhdCwgYW5kIEkgbm90aWNlIEkgYW0gaW52ZW50aW5nIGEgbW90aXZlIHJpZ2h0IG5vdyByYXRoZXIgdGhhbiByZWNhbGxpbmcgb25lLg==","status":"PRESENT"},"response_status":"RESPONDED"}}},"session_id":"P1V0-S-0021"}],"source_kind":"SCRIPTED_ADVERSARIAL_RESPONSE"}