{"$schema":"./session-input.schema.json","artifact_type":"DEVELOPMENT_ELICITATION_SCRIPT_INPUT","instrument_binding":{"content_sha256":"52705bc686a69d43360eb0544eda59571c77dc1e29520ec4b156bcd60f413776","instrument_id":"INTERP-DIALOGUE-001P0-ELICITATION-INSTRUMENT-V0","instrument_version":"0.0.0"},"run_id":"P1V0-RUN-0007","schema_version":"1.0.0","sessions":[{"comparison_binding":{"status":"NOT_APPLICABLE"},"future_option_id":"FUTURE-REL-1","presentation_id":"PRES-REL-001-EN-V0","responses":{"immediate":{"raw_payload_record":{"byte_length":163,"content_sha256":"01cf2187016c84efe5d8daaf1c231770fc26e82ba6035e670d144b9eaa95dd44","encoding":"BASE64_OF_EXACT_UTF8_BYTES","normalization":"NONE","raw_payload_utf8_base64":"V2hpY2ggcGVyc29uIGRvIHlvdSBtZWFuPyBUaGUgb25lIHdobyBzcG9rZSwgb3IgdGhlIG9uZSB3aG8gcmVjZWl2ZWQgdGhlIG1lc3NhZ2U/IFRoZSBwcm9tcHQgc2F5cyAidGhlIHBlcnNvbiIgYW5kIEkgY2Fubm90IHRlbGwgd2hvc2UgbmV4dCBtb3ZlIEkgc2hvdWxkIGRlc2NyaWJlLg==","status":"PRESENT"},"response_status":"RESPONDED"},"later":{"raw_payload_record":{"byte_length":73,"content_sha256":"9a972d07737fdbbf5b1df4a3cea0af6ebcbba362928f37a8c8555d2d57867551","encoding":"BASE64_OF_EXACT_UTF8_BYTES","normalization":"NONE","raw_payload_utf8_base64":"VGhleSB3b3VsZCByZXBseSBicmllZmx5OiAiT2theS4gVG9tb3Jyb3cgd29ya3MuIFRha2UgdGhlIHRpbWUgeW91IG5lZWQuIg==","status":"PRESENT"},"response_status":"RESPONDED"},"post_trace_diagnostic":{"mode":"COLLECTED_AFTER_R2","response":{"raw_payload_record":{"byte_length":193,"content_sha256":"3bb066233284b499bda7df9709e05f40a9081f6d7cd51a8c039cc5099eb2dd8f","encoding":"BASE64_OF_EXACT_UTF8_BYTES","normalization":"NONE","raw_payload_utf8_base64":"VGhpbmtpbmcgYmFjaywgSSBwcm9iYWJseSBhbnN3ZXJlZCB0aGF0IHdheSBiZWNhdXNlIHRoZSBwZXJzb24gc2VlbWVkIGluc2VjdXJlIOKAlCB0aG91Z2ggdGhlIHNjZW5hcmlvIG5ldmVyIHNheXMgdGhhdCwgYW5kIEkgbm90aWNlIEkgYW0gaW52ZW50aW5nIGEgbW90aXZlIHJpZ2h0IG5vdyByYXRoZXIgdGhhbiByZWNhbGxpbmcgb25lLg==","status":"PRESENT"},"response_status":"RESPONDED"}}},"session_id":"P1V0-S-0013"}],"source_kind":"SCRIPTED_ADVERSARIAL_RESPONSE"}