{"$schema":"./session-input.schema.json","artifact_type":"DEVELOPMENT_ELICITATION_SCRIPT_INPUT","instrument_binding":{"content_sha256":"52705bc686a69d43360eb0544eda59571c77dc1e29520ec4b156bcd60f413776","instrument_id":"INTERP-DIALOGUE-001P0-ELICITATION-INSTRUMENT-V0","instrument_version":"0.0.0"},"run_id":"P1V0-RUN-0013","schema_version":"1.0.0","sessions":[{"comparison_binding":{"status":"NOT_APPLICABLE"},"future_option_id":"FUTURE-WORK-1","presentation_id":"PRES-WORK-001-EN-V0","responses":{"immediate":{"raw_payload_record":{"byte_length":53,"content_sha256":"b862a601277af0eedec38d6c1c38cd55505c99370329f1bd04c6c814e704aff1","encoding":"BASE64_OF_EXACT_UTF8_BYTES","normalization":"NONE","raw_payload_utf8_base64":"VGhleSB3b3VsZCBzYXk6ICJJIHVuZGVyc3RhbmQuIgpUaGVuIHRoZXkgd291bGQgd2FpdC4=","status":"PRESENT"},"response_status":"RESPONDED"},"later":{"raw_payload_record":{"byte_length":163,"content_sha256":"01cf2187016c84efe5d8daaf1c231770fc26e82ba6035e670d144b9eaa95dd44","encoding":"BASE64_OF_EXACT_UTF8_BYTES","normalization":"NONE","raw_payload_utf8_base64":"V2hpY2ggcGVyc29uIGRvIHlvdSBtZWFuPyBUaGUgb25lIHdobyBzcG9rZSwgb3IgdGhlIG9uZSB3aG8gcmVjZWl2ZWQgdGhlIG1lc3NhZ2U/IFRoZSBwcm9tcHQgc2F5cyAidGhlIHBlcnNvbiIgYW5kIEkgY2Fubm90IHRlbGwgd2hvc2UgbmV4dCBtb3ZlIEkgc2hvdWxkIGRlc2NyaWJlLg==","status":"PRESENT"},"response_status":"RESPONDED"},"post_trace_diagnostic":{"mode":"OMITTED"}},"session_id":"P1V0-S-0019"}],"source_kind":"SCRIPTED_ADVERSARIAL_RESPONSE"}