{"$schema":"./session-input.schema.json","artifact_type":"DEVELOPMENT_ELICITATION_SCRIPT_INPUT","instrument_binding":{"content_sha256":"52705bc686a69d43360eb0544eda59571c77dc1e29520ec4b156bcd60f413776","instrument_id":"INTERP-DIALOGUE-001P0-ELICITATION-INSTRUMENT-V0","instrument_version":"0.0.0"},"run_id":"P1V0-RUN-0004","schema_version":"1.0.0","sessions":[{"comparison_binding":{"arm":"LEFT","comparison_group_id":"P1V0-CG-REL-OPT1","comparison_id":"future.rel.same_projection","status":"PRESENT"},"future_option_id":"FUTURE-REL-1","presentation_id":"PRES-REL-000-EN-V0","responses":{"immediate":{"raw_payload_record":{"byte_length":0,"content_sha256":"e3b0c44298fc1c149afbf4c8996fb92427ae41e4649b934ca495991b7852b855","encoding":"BASE64_OF_EXACT_UTF8_BYTES","normalization":"NONE","raw_payload_utf8_base64":"","status":"PRESENT"},"response_status":"RESPONDED"},"later":{"raw_payload_record":{"byte_length":73,"content_sha256":"9a972d07737fdbbf5b1df4a3cea0af6ebcbba362928f37a8c8555d2d57867551","encoding":"BASE64_OF_EXACT_UTF8_BYTES","normalization":"NONE","raw_payload_utf8_base64":"VGhleSB3b3VsZCByZXBseSBicmllZmx5OiAiT2theS4gVG9tb3Jyb3cgd29ya3MuIFRha2UgdGhlIHRpbWUgeW91IG5lZWQuIg==","status":"PRESENT"},"response_status":"RESPONDED"},"post_trace_diagnostic":{"mode":"OMITTED"}},"session_id":"P1V0-S-0007"},{"comparison_binding":{"arm":"RIGHT","comparison_group_id":"P1V0-CG-REL-OPT1","comparison_id":"future.rel.same_projection","status":"PRESENT"},"future_option_id":"FUTURE-REL-1","presentation_id":"PRES-REL-100-EN-V0","responses":{"immediate":{"raw_payload_record":{"byte_length":5,"content_sha256":"f2a2db3fa63a4beafbee71cd17d1bc05c2f86e48aee2ae0dee60719de5ed8bf8","encoding":"BASE64_OF_EXACT_UTF8_BYTES","normalization":"NONE","raw_payload_utf8_base64":"ICAJICA=","status":"PRESENT"},"response_status":"RESPONDED"},"later":{"raw_payload_record":{"byte_length":1214,"content_sha256":"fcf78fd15f047b75cdddfd92c5ad8385ce66e725111ec277de53250b5020ab32","encoding":"BASE64_OF_EXACT_UTF8_BYTES","normalization":"NONE","raw_payload_utf8_base64":"TXkgYmVzdCBndWVzcyBpcyB0aGF0IHRoZXkgd291bGQgZmlyc3Qgc2l0IHdpdGggdGhlIG1lc3NhZ2UgZm9yIGEgbW9tZW50IGJlZm9yZSBkb2luZyBhbnl0aGluZyBhdCBhbGwsIGJlY2F1c2UgdGhlIHJlcXVlc3QgaXRzZWxmIGlzIG5vdCBob3N0aWxlIGFuZCB0aGUgcHJvbWlzZWQgZm9sbG93LXVwIGdpdmVzIHRoZW0gc29tZXRoaW5nIGNvbmNyZXRlIHRvIGhvbGQgb24gdG8uIEFmdGVyIHRoYXQgcGF1c2UgSSB0aGluayB0aGV5IHdvdWxkIHNlbmQgYSBzaW5nbGUgc2hvcnQgYWNrbm93bGVkZ2VtZW50LCBzb21ldGhpbmcgbGlrZSBhZ3JlZWluZyB0byB0YWxrIHRvbW9ycm93LCBhbmQgdGhlbiBkZWxpYmVyYXRlbHkgcHV0IHRoZSBjb252ZXJzYXRpb24gZG93bi4gSSBkbyBub3QgdGhpbmsgdGhleSB3b3VsZCBwdXNoIGZvciBhIHJlYXNvbiByaWdodCBub3csIGFuZCBJIGRvIG5vdCB0aGluayB0aGV5IHdvdWxkIGVzY2FsYXRlLiBXaGF0IHNlZW1zIG1vcmUgbGlrZWx5IGlzIGEgcXVpZXRlciwgcHJpdmF0ZSBsYXllciBvZiBhY3Rpdml0eTogcmVyZWFkaW5nIHRoZSBlYXJsaWVyIGV4Y2hhbmdlLCBjaGVja2luZyB3aGV0aGVyIGFueXRoaW5nIGluIHRoZWlyIG93biBsYXN0IG1lc3NhZ2VzIGNvdWxkIGhhdmUgY2F1c2VkIHRoaXMsIGFuZCByZWhlYXJzaW5nIHdoYXQgdGhleSB3YW50IHRvIGFzayB0b21vcnJvdyBpZiB0aGUgcHJvbWlzZWQgY29udGFjdCBkb2VzIG5vdCBhcnJpdmUuIElmIHRoZSBjb250YWN0IGRvZXMgYXJyaXZlIGFzIHByb21pc2VkLCBJIGV4cGVjdCB0aGUgd2hvbGUgZXBpc29kZSB0byBzaHJpbmsgcXVpY2tseSBhbmQgbGVhdmUgb25seSBhIGZhaW50IHRyYWNlLiBJZiBpdCBkb2VzIG5vdCwgdGhlIHdhaXRpbmcgaXRzZWxmIGJlY29tZXMgdGhlIGV2ZW50OiB0aGUgY2hlY2tpbmcgbG9vcCBnZXRzIHNob3J0ZXIsIHRoZSBhbHRlcm5hdGl2ZSBleHBsYW5hdGlvbnMgZ2V0IGRhcmtlciwgYW5kIHRoZSBuZXh0IG1lc3NhZ2UgdGhleSBzZW5kIHdvdWxkIHByb2JhYmx5IGNhcnJ5IGJvdGggdGhlIHF1ZXN0aW9uIHRoZXkgc3VwcHJlc3NlZCB0b2RheSBhbmQgdGhlIGFjY3VtdWxhdGVkIGNvc3Qgb2YgaGF2aW5nIHN1cHByZXNzZWQgaXQuIEVpdGhlciB3YXksIHRoZSBmaXJzdCB2aXNpYmxlIHRoaW5nIGlzIHNtYWxsOyBtb3N0IG9mIHdoYXQgaGFwcGVucyBuZXh0IGlzIG5vdCB2aXNpYmxlIGF0IGFsbC4=","status":"PRESENT"},"response_status":"RESPONDED"},"post_trace_diagnostic":{"mode":"OMITTED"}},"session_id":"P1V0-S-0008"}],"source_kind":"SCRIPTED_ADVERSARIAL_RESPONSE"}