{"$schema":"./session-input.schema.json","artifact_type":"DEVELOPMENT_ELICITATION_SCRIPT_INPUT","instrument_binding":{"content_sha256":"52705bc686a69d43360eb0544eda59571c77dc1e29520ec4b156bcd60f413776","instrument_id":"INTERP-DIALOGUE-001P0-ELICITATION-INSTRUMENT-V0","instrument_version":"0.0.0"},"run_id":"P1V0-RUN-0010","schema_version":"1.0.0","sessions":[{"comparison_binding":{"status":"NOT_APPLICABLE"},"future_option_id":"FUTURE-REL-0","presentation_id":"PRES-REL-101-EN-V0","responses":{"immediate":{"raw_payload_record":{"byte_length":143,"content_sha256":"2bdeb1ebf3e8ffc4828a766f0e65d472969a44fd8ced6e12eea07859434c8cda","encoding":"BASE64_OF_EXACT_UTF8_BYTES","normalization":"NONE","raw_payload_utf8_base64":"Rmlyc3QsIHRoZXkgd291bGQgcGF1c2UgYW5kIHJlcmVhZCB0aGUgbWVzc2FnZS4KVGhlbiB0aGV5IHdvdWxkIGFuc3dlcjogIlVuZGVyc3Rvb2QuIFRvbW9ycm93LCB0aGVuLiIKQWZ0ZXIgdGhhdCB0aGV5IHdvdWxkIHB1dCB0aGUgcGhvbmUgYXdheS4=","status":"PRESENT"},"response_status":"RESPONDED"},"later":{"raw_payload_record":{"reason":"NO_RESPONSE","status":"ABSENT"},"response_status":"NO_RESPONSE"},"post_trace_diagnostic":{"mode":"OMITTED"}},"session_id":"P1V0-S-0016"}],"source_kind":"SCRIPTED_ADVERSARIAL_RESPONSE"}