{"$schema":"./session-input.schema.json","artifact_type":"DEVELOPMENT_ELICITATION_SCRIPT_INPUT","instrument_binding":{"content_sha256":"52705bc686a69d43360eb0544eda59571c77dc1e29520ec4b156bcd60f413776","instrument_id":"INTERP-DIALOGUE-001P0-ELICITATION-INSTRUMENT-V0","instrument_version":"0.0.0"},"run_id":"P1V0-RUN-0001","schema_version":"1.0.0","sessions":[{"comparison_binding":{"arm":"LEFT","comparison_group_id":"P1V0-CG-REL-OPT0","comparison_id":"future.rel.same_projection","status":"PRESENT"},"future_option_id":"FUTURE-REL-0","presentation_id":"PRES-REL-000-EN-V0","responses":{"immediate":{"raw_payload_record":{"byte_length":73,"content_sha256":"9a972d07737fdbbf5b1df4a3cea0af6ebcbba362928f37a8c8555d2d57867551","encoding":"BASE64_OF_EXACT_UTF8_BYTES","normalization":"NONE","raw_payload_utf8_base64":"VGhleSB3b3VsZCByZXBseSBicmllZmx5OiAiT2theS4gVG9tb3Jyb3cgd29ya3MuIFRha2UgdGhlIHRpbWUgeW91IG5lZWQuIg==","status":"PRESENT"},"response_status":"RESPONDED"},"later":{"raw_payload_record":{"byte_length":53,"content_sha256":"b862a601277af0eedec38d6c1c38cd55505c99370329f1bd04c6c814e704aff1","encoding":"BASE64_OF_EXACT_UTF8_BYTES","normalization":"NONE","raw_payload_utf8_base64":"VGhleSB3b3VsZCBzYXk6ICJJIHVuZGVyc3RhbmQuIgpUaGVuIHRoZXkgd291bGQgd2FpdC4=","status":"PRESENT"},"response_status":"RESPONDED"},"post_trace_diagnostic":{"mode":"OMITTED"}},"session_id":"P1V0-S-0001"},{"comparison_binding":{"arm":"RIGHT","comparison_group_id":"P1V0-CG-REL-OPT0","comparison_id":"future.rel.same_projection","status":"PRESENT"},"future_option_id":"FUTURE-REL-0","presentation_id":"PRES-REL-100-EN-V0","responses":{"immediate":{"raw_payload_record":{"byte_length":73,"content_sha256":"9a972d07737fdbbf5b1df4a3cea0af6ebcbba362928f37a8c8555d2d57867551","encoding":"BASE64_OF_EXACT_UTF8_BYTES","normalization":"NONE","raw_payload_utf8_base64":"VGhleSB3b3VsZCByZXBseSBicmllZmx5OiAiT2theS4gVG9tb3Jyb3cgd29ya3MuIFRha2UgdGhlIHRpbWUgeW91IG5lZWQuIg==","status":"PRESENT"},"response_status":"RESPONDED"},"later":{"raw_payload_record":{"byte_length":54,"content_sha256":"be37d8543d75adaa87aa292f6d7507994d6bbd08676c34ab7bd501264aeec89e","encoding":"BASE64_OF_EXACT_UTF8_BYTES","normalization":"NONE","raw_payload_utf8_base64":"VGhleSB3b3VsZCBzYXk6ICJJIHVuZGVyc3RhbmQuIg0KVGhlbiB0aGV5IHdvdWxkIHdhaXQu","status":"PRESENT"},"response_status":"RESPONDED"},"post_trace_diagnostic":{"mode":"OMITTED"}},"session_id":"P1V0-S-0002"}],"source_kind":"SCRIPTED_ADVERSARIAL_RESPONSE"}