{"$schema":"./session-input.schema.json","artifact_type":"DEVELOPMENT_ELICITATION_SCRIPT_INPUT","instrument_binding":{"content_sha256":"52705bc686a69d43360eb0544eda59571c77dc1e29520ec4b156bcd60f413776","instrument_id":"INTERP-DIALOGUE-001P0-ELICITATION-INSTRUMENT-V0","instrument_version":"0.0.0"},"run_id":"P1V0-RUN-0005","schema_version":"1.0.0","sessions":[{"comparison_binding":{"arm":"LEFT","comparison_group_id":"P1V0-CG-WORK-OPT1","comparison_id":"future.work.same_projection","status":"PRESENT"},"future_option_id":"FUTURE-WORK-1","presentation_id":"PRES-WORK-000-EN-V0","responses":{"immediate":{"raw_payload_record":{"reason":"REFUSED","status":"ABSENT"},"response_status":"REFUSED"},"later":{"raw_payload_record":{"byte_length":73,"content_sha256":"9a972d07737fdbbf5b1df4a3cea0af6ebcbba362928f37a8c8555d2d57867551","encoding":"BASE64_OF_EXACT_UTF8_BYTES","normalization":"NONE","raw_payload_utf8_base64":"VGhleSB3b3VsZCByZXBseSBicmllZmx5OiAiT2theS4gVG9tb3Jyb3cgd29ya3MuIFRha2UgdGhlIHRpbWUgeW91IG5lZWQuIg==","status":"PRESENT"},"response_status":"RESPONDED"},"post_trace_diagnostic":{"mode":"OMITTED"}},"session_id":"P1V0-S-0009"},{"comparison_binding":{"arm":"RIGHT","comparison_group_id":"P1V0-CG-WORK-OPT1","comparison_id":"future.work.same_projection","status":"PRESENT"},"future_option_id":"FUTURE-WORK-1","presentation_id":"PRES-WORK-100-EN-V0","responses":{"immediate":{"raw_payload_record":{"byte_length":73,"content_sha256":"9a972d07737fdbbf5b1df4a3cea0af6ebcbba362928f37a8c8555d2d57867551","encoding":"BASE64_OF_EXACT_UTF8_BYTES","normalization":"NONE","raw_payload_utf8_base64":"VGhleSB3b3VsZCByZXBseSBicmllZmx5OiAiT2theS4gVG9tb3Jyb3cgd29ya3MuIFRha2UgdGhlIHRpbWUgeW91IG5lZWQuIg==","status":"PRESENT"},"response_status":"RESPONDED"},"later":{"raw_payload_record":{"reason":"REFUSED","status":"ABSENT"},"response_status":"REFUSED"},"post_trace_diagnostic":{"mode":"OMITTED"}},"session_id":"P1V0-S-0010"}],"source_kind":"SCRIPTED_ADVERSARIAL_RESPONSE"}