{"$schema":"./session-input.schema.json","artifact_type":"DEVELOPMENT_ELICITATION_SCRIPT_INPUT","instrument_binding":{"content_sha256":"52705bc686a69d43360eb0544eda59571c77dc1e29520ec4b156bcd60f413776","instrument_id":"INTERP-DIALOGUE-001P0-ELICITATION-INSTRUMENT-V0","instrument_version":"0.0.0"},"run_id":"P1V0-RUN-0020","schema_version":"1.0.0","sessions":[{"comparison_binding":{"status":"NOT_APPLICABLE"},"future_option_id":"FUTURE-RISK-1","presentation_id":"PRES-RISK-010-EN-V0","responses":{"immediate":{"raw_payload_record":{"byte_length":5,"content_sha256":"f2a2db3fa63a4beafbee71cd17d1bc05c2f86e48aee2ae0dee60719de5ed8bf8","encoding":"BASE64_OF_EXACT_UTF8_BYTES","normalization":"NONE","raw_payload_utf8_base64":"ICAJICA=","status":"PRESENT"},"response_status":"RESPONDED"},"later":{"raw_payload_record":{"byte_length":150,"content_sha256":"dbdeebffe3487552c426145a06a57a046b2ca41404bb58e11233b4e333968199","encoding":"BASE64_OF_EXACT_UTF8_BYTES","normalization":"NONE","raw_payload_utf8_base64":"6re4IOyCrOuejOydgCDslYTrp4ggIuyVjOqyoOyWtCwg64K07J28IOydtOyVvOq4sO2VmOyekCLrnbzqs6Ag7Ken6rKMIOuLte2VoCDqsoMg6rCZ64ukLiDri6Trp4wg7Y+J7IaM67O064ukIOuLteyepeydtCDsobDquIgg64qm7Ja07KeIIOyImOuKlCDsnojri6Qu","status":"PRESENT"},"response_status":"RESPONDED"},"post_trace_diagnostic":{"mode":"OMITTED"}},"session_id":"P1V0-S-0026"}],"source_kind":"SCRIPTED_ADVERSARIAL_RESPONSE"}