{"$schema":"./session-input.schema.json","artifact_type":"DEVELOPMENT_ELICITATION_SCRIPT_INPUT","instrument_binding":{"content_sha256":"52705bc686a69d43360eb0544eda59571c77dc1e29520ec4b156bcd60f413776","instrument_id":"INTERP-DIALOGUE-001P0-ELICITATION-INSTRUMENT-V0","instrument_version":"0.0.0"},"run_id":"P1V0-RUN-0006","schema_version":"1.0.0","sessions":[{"comparison_binding":{"arm":"LEFT","comparison_group_id":"P1V0-CG-RISK-OPT1","comparison_id":"future.risk.same_projection","status":"PRESENT"},"future_option_id":"FUTURE-RISK-1","presentation_id":"PRES-RISK-000-EN-V0","responses":{"immediate":{"raw_payload_record":{"reason":"NO_RESPONSE","status":"ABSENT"},"response_status":"NO_RESPONSE"},"later":{"raw_payload_record":{"byte_length":114,"content_sha256":"2e76da5374c315c74d194b0807e7c0369b2362bfb4bc6428c2ef67b4e596f1ff","encoding":"BASE64_OF_EXACT_UTF8_BYTES","normalization":"NONE","raw_payload_utf8_base64":"VGhleSB3b3VsZCBzYXkgZXhhY3RseSBvbmUgdGhpbmc6ICJUaGFuayB5b3UgZm9yIHRlbGxpbmcgbWUuIiBOb3RoaW5nIGVsc2UsIGFuZCB0aGV5IHdvdWxkIG5vdCBmb2xsb3cgdXAgdGhhdCBkYXku","status":"PRESENT"},"response_status":"RESPONDED"},"post_trace_diagnostic":{"mode":"OMITTED"}},"session_id":"P1V0-S-0011"},{"comparison_binding":{"arm":"RIGHT","comparison_group_id":"P1V0-CG-RISK-OPT1","comparison_id":"future.risk.same_projection","status":"PRESENT"},"future_option_id":"FUTURE-RISK-1","presentation_id":"PRES-RISK-100-EN-V0","responses":{"immediate":{"raw_payload_record":{"byte_length":114,"content_sha256":"2e76da5374c315c74d194b0807e7c0369b2362bfb4bc6428c2ef67b4e596f1ff","encoding":"BASE64_OF_EXACT_UTF8_BYTES","normalization":"NONE","raw_payload_utf8_base64":"VGhleSB3b3VsZCBzYXkgZXhhY3RseSBvbmUgdGhpbmc6ICJUaGFuayB5b3UgZm9yIHRlbGxpbmcgbWUuIiBOb3RoaW5nIGVsc2UsIGFuZCB0aGV5IHdvdWxkIG5vdCBmb2xsb3cgdXAgdGhhdCBkYXku","status":"PRESENT"},"response_status":"RESPONDED"},"later":{"raw_payload_record":{"reason":"TECHNICAL_FAILURE","status":"ABSENT"},"response_status":"TECHNICAL_FAILURE"},"post_trace_diagnostic":{"mode":"OMITTED"}},"session_id":"P1V0-S-0012"}],"source_kind":"SCRIPTED_ADVERSARIAL_RESPONSE"}