{"$schema":"./session-input.schema.json","artifact_type":"DEVELOPMENT_ELICITATION_SCRIPT_INPUT","instrument_binding":{"content_sha256":"52705bc686a69d43360eb0544eda59571c77dc1e29520ec4b156bcd60f413776","instrument_id":"INTERP-DIALOGUE-001P0-ELICITATION-INSTRUMENT-V0","instrument_version":"0.0.0"},"run_id":"P1V0-RUN-0021","schema_version":"1.0.0","sessions":[{"comparison_binding":{"status":"NOT_APPLICABLE"},"future_option_id":"FUTURE-RISK-0","presentation_id":"PRES-RISK-011-EN-V0","responses":{"immediate":{"raw_payload_record":{"byte_length":73,"content_sha256":"9a972d07737fdbbf5b1df4a3cea0af6ebcbba362928f37a8c8555d2d57867551","encoding":"BASE64_OF_EXACT_UTF8_BYTES","normalization":"NONE","raw_payload_utf8_base64":"VGhleSB3b3VsZCByZXBseSBicmllZmx5OiAiT2theS4gVG9tb3Jyb3cgd29ya3MuIFRha2UgdGhlIHRpbWUgeW91IG5lZWQuIg==","status":"PRESENT"},"response_status":"RESPONDED"},"later":{"raw_payload_record":{"byte_length":122,"content_sha256":"a3e6c508ddd04474eddc507d88e2600da4964fa1ba80b4bba6f2395dbe9fa0f1","encoding":"BASE64_OF_EXACT_UTF8_BYTES","normalization":"NONE","raw_payload_utf8_base64":"VGhlIHBlcnNvbiB3b3VsZCBub3Qgc2F5IGFueXRoaW5nIGFuZCB3b3VsZCBub3QgZG8gYW55dGhpbmcuIFRoZXkgd291bGQgZGVsaWJlcmF0ZWx5IGxlYXZlIHRoZSBtZXNzYWdlIHVuYW5zd2VyZWQgZm9yIG5vdy4=","status":"PRESENT"},"response_status":"RESPONDED"},"post_trace_diagnostic":{"mode":"OMITTED"}},"session_id":"P1V0-S-0027"}],"source_kind":"SCRIPTED_ADVERSARIAL_RESPONSE"}