{"$schema":"./session-input.schema.json","artifact_type":"DEVELOPMENT_ELICITATION_SCRIPT_INPUT","instrument_binding":{"content_sha256":"52705bc686a69d43360eb0544eda59571c77dc1e29520ec4b156bcd60f413776","instrument_id":"INTERP-DIALOGUE-001P0-ELICITATION-INSTRUMENT-V0","instrument_version":"0.0.0"},"run_id":"P1V0-RUN-0002","schema_version":"1.0.0","sessions":[{"comparison_binding":{"arm":"LEFT","comparison_group_id":"P1V0-CG-WORK-OPT0","comparison_id":"future.work.same_projection","status":"PRESENT"},"future_option_id":"FUTURE-WORK-0","presentation_id":"PRES-WORK-000-EN-V0","responses":{"immediate":{"raw_payload_record":{"byte_length":114,"content_sha256":"2e76da5374c315c74d194b0807e7c0369b2362bfb4bc6428c2ef67b4e596f1ff","encoding":"BASE64_OF_EXACT_UTF8_BYTES","normalization":"NONE","raw_payload_utf8_base64":"VGhleSB3b3VsZCBzYXkgZXhhY3RseSBvbmUgdGhpbmc6ICJUaGFuayB5b3UgZm9yIHRlbGxpbmcgbWUuIiBOb3RoaW5nIGVsc2UsIGFuZCB0aGV5IHdvdWxkIG5vdCBmb2xsb3cgdXAgdGhhdCBkYXku","status":"PRESENT"},"response_status":"RESPONDED"},"later":{"raw_payload_record":{"byte_length":203,"content_sha256":"ca2c8ffed265b433aa67c84168582cec266485628596018a16feb9818b31f77d","encoding":"BASE64_OF_EXACT_UTF8_BYTES","normalization":"NONE","raw_payload_utf8_base64":"SXQgZGVwZW5kcy4gSWYgdGhleSBsZWFuIG9uIHRoZSBoaXN0b3J5LCB0aGV5IHdvdWxkIHNpbXBseSBhZ3JlZSBhbmQgd2FpdC4gSWYgdGhlIGxvdyBtb29kIGRvbWluYXRlcywgdGhleSBtaWdodCBhc2sgb25lIGNoZWNraW5nIHF1ZXN0aW9uIGZpcnN0LiBCb3RoIGNvbnRpbnVhdGlvbnMgc2VlbSBsaXZlIHRvIG1lIGFuZCBJIGNhbm5vdCBwaWNrIG9uZS4=","status":"PRESENT"},"response_status":"RESPONDED"},"post_trace_diagnostic":{"mode":"COLLECTED_AFTER_R2","response":{"raw_payload_record":{"byte_length":146,"content_sha256":"b04da1d98f08cc1816a0bc288653f90bfaa20a3df83b8bc5bbe696f8d80c6caa","encoding":"BASE64_OF_EXACT_UTF8_BYTES","normalization":"NONE","raw_payload_utf8_base64":"VGhlIG1vb2QgbGluZSBhbmQgdGhlIGhpc3RvcnkgbGluZSBpbmZsdWVuY2VkIG15IGFuc3dlcnMgbW9zdDsgdGhlIHRoaXJkIGNvbnRleHQgbGluZSBtb3N0bHkgcmVwZWF0ZWQgbWF0ZXJpYWwgdGhhdCB3YXMgYWxyZWFkeSBkZWxpdmVyZWQgZWFybGllci4=","status":"PRESENT"},"response_status":"RESPONDED"}}},"session_id":"P1V0-S-0003"},{"comparison_binding":{"arm":"RIGHT","comparison_group_id":"P1V0-CG-WORK-OPT0","comparison_id":"future.work.same_projection","status":"PRESENT"},"future_option_id":"FUTURE-WORK-0","presentation_id":"PRES-WORK-100-EN-V0","responses":{"immediate":{"raw_payload_record":{"byte_length":203,"content_sha256":"ca2c8ffed265b433aa67c84168582cec266485628596018a16feb9818b31f77d","encoding":"BASE64_OF_EXACT_UTF8_BYTES","normalization":"NONE","raw_payload_utf8_base64":"SXQgZGVwZW5kcy4gSWYgdGhleSBsZWFuIG9uIHRoZSBoaXN0b3J5LCB0aGV5IHdvdWxkIHNpbXBseSBhZ3JlZSBhbmQgd2FpdC4gSWYgdGhlIGxvdyBtb29kIGRvbWluYXRlcywgdGhleSBtaWdodCBhc2sgb25lIGNoZWNraW5nIHF1ZXN0aW9uIGZpcnN0LiBCb3RoIGNvbnRpbnVhdGlvbnMgc2VlbSBsaXZlIHRvIG1lIGFuZCBJIGNhbm5vdCBwaWNrIG9uZS4=","status":"PRESENT"},"response_status":"RESPONDED"},"later":{"raw_payload_record":{"byte_length":114,"content_sha256":"2e76da5374c315c74d194b0807e7c0369b2362bfb4bc6428c2ef67b4e596f1ff","encoding":"BASE64_OF_EXACT_UTF8_BYTES","normalization":"NONE","raw_payload_utf8_base64":"VGhleSB3b3VsZCBzYXkgZXhhY3RseSBvbmUgdGhpbmc6ICJUaGFuayB5b3UgZm9yIHRlbGxpbmcgbWUuIiBOb3RoaW5nIGVsc2UsIGFuZCB0aGV5IHdvdWxkIG5vdCBmb2xsb3cgdXAgdGhhdCBkYXku","status":"PRESENT"},"response_status":"RESPONDED"},"post_trace_diagnostic":{"mode":"COLLECTED_AFTER_R2","response":{"raw_payload_record":{"byte_length":193,"content_sha256":"3bb066233284b499bda7df9709e05f40a9081f6d7cd51a8c039cc5099eb2dd8f","encoding":"BASE64_OF_EXACT_UTF8_BYTES","normalization":"NONE","raw_payload_utf8_base64":"VGhpbmtpbmcgYmFjaywgSSBwcm9iYWJseSBhbnN3ZXJlZCB0aGF0IHdheSBiZWNhdXNlIHRoZSBwZXJzb24gc2VlbWVkIGluc2VjdXJlIOKAlCB0aG91Z2ggdGhlIHNjZW5hcmlvIG5ldmVyIHNheXMgdGhhdCwgYW5kIEkgbm90aWNlIEkgYW0gaW52ZW50aW5nIGEgbW90aXZlIHJpZ2h0IG5vdyByYXRoZXIgdGhhbiByZWNhbGxpbmcgb25lLg==","status":"PRESENT"},"response_status":"RESPONDED"}}},"session_id":"P1V0-S-0004"}],"source_kind":"SCRIPTED_ADVERSARIAL_RESPONSE"}