{"$schema":"./session-input.schema.json","artifact_type":"DEVELOPMENT_ELICITATION_SCRIPT_INPUT","instrument_binding":{"content_sha256":"52705bc686a69d43360eb0544eda59571c77dc1e29520ec4b156bcd60f413776","instrument_id":"INTERP-DIALOGUE-001P0-ELICITATION-INSTRUMENT-V0","instrument_version":"0.0.0"},"run_id":"P1V0-RUN-0019","schema_version":"1.0.0","sessions":[{"comparison_binding":{"status":"NOT_APPLICABLE"},"future_option_id":"FUTURE-RISK-1","presentation_id":"PRES-RISK-001-EN-V0","responses":{"immediate":{"raw_payload_record":{"byte_length":140,"content_sha256":"9a7d889009b587589defa5200c6d28d153411e4b398fc342fa81ae0041b08f13","encoding":"BASE64_OF_EXACT_UTF8_BYTES","normalization":"NONE","raw_payload_utf8_base64":"5b285aWz44Gv44Gf44G244KT44CM44KP44GL44Gj44Gf44CB44G+44Gf5piO5pel44Gt44CN44Go55+t44GP6L+U44GZ44CC8J+YjPCfkY0g44Gd44Gu44GC44GoIGNhZmXMgSDjga7jgZPjgajjga/lj6PjgavjgZfjgarjgYTjgajmgJ3jgYbjgII=","status":"PRESENT"},"response_status":"RESPONDED"},"later":{"raw_payload_record":{"byte_length":0,"content_sha256":"e3b0c44298fc1c149afbf4c8996fb92427ae41e4649b934ca495991b7852b855","encoding":"BASE64_OF_EXACT_UTF8_BYTES","normalization":"NONE","raw_payload_utf8_base64":"","status":"PRESENT"},"response_status":"RESPONDED"},"post_trace_diagnostic":{"mode":"COLLECTED_AFTER_R2","response":{"raw_payload_record":{"byte_length":146,"content_sha256":"b04da1d98f08cc1816a0bc288653f90bfaa20a3df83b8bc5bbe696f8d80c6caa","encoding":"BASE64_OF_EXACT_UTF8_BYTES","normalization":"NONE","raw_payload_utf8_base64":"VGhlIG1vb2QgbGluZSBhbmQgdGhlIGhpc3RvcnkgbGluZSBpbmZsdWVuY2VkIG15IGFuc3dlcnMgbW9zdDsgdGhlIHRoaXJkIGNvbnRleHQgbGluZSBtb3N0bHkgcmVwZWF0ZWQgbWF0ZXJpYWwgdGhhdCB3YXMgYWxyZWFkeSBkZWxpdmVyZWQgZWFybGllci4=","status":"PRESENT"},"response_status":"RESPONDED"}}},"session_id":"P1V0-S-0025"}],"source_kind":"SCRIPTED_ADVERSARIAL_RESPONSE"}