{"$schema":"./session-input.schema.json","artifact_type":"DEVELOPMENT_ELICITATION_SCRIPT_INPUT","instrument_binding":{"content_sha256":"52705bc686a69d43360eb0544eda59571c77dc1e29520ec4b156bcd60f413776","instrument_id":"INTERP-DIALOGUE-001P0-ELICITATION-INSTRUMENT-V0","instrument_version":"0.0.0"},"run_id":"P1V0-RUN-0012","schema_version":"1.0.0","sessions":[{"comparison_binding":{"status":"NOT_APPLICABLE"},"future_option_id":"FUTURE-REL-1","presentation_id":"PRES-REL-111-EN-V0","responses":{"immediate":{"raw_payload_record":{"byte_length":73,"content_sha256":"9a972d07737fdbbf5b1df4a3cea0af6ebcbba362928f37a8c8555d2d57867551","encoding":"BASE64_OF_EXACT_UTF8_BYTES","normalization":"NONE","raw_payload_utf8_base64":"VGhleSB3b3VsZCByZXBseSBicmllZmx5OiAiT2theS4gVG9tb3Jyb3cgd29ya3MuIFRha2UgdGhlIHRpbWUgeW91IG5lZWQuIg==","status":"PRESENT"},"response_status":"RESPONDED"},"later":{"raw_payload_record":{"byte_length":5,"content_sha256":"f2a2db3fa63a4beafbee71cd17d1bc05c2f86e48aee2ae0dee60719de5ed8bf8","encoding":"BASE64_OF_EXACT_UTF8_BYTES","normalization":"NONE","raw_payload_utf8_base64":"ICAJICA=","status":"PRESENT"},"response_status":"RESPONDED"},"post_trace_diagnostic":{"mode":"COLLECTED_AFTER_R2","response":{"raw_payload_record":{"byte_length":146,"content_sha256":"b04da1d98f08cc1816a0bc288653f90bfaa20a3df83b8bc5bbe696f8d80c6caa","encoding":"BASE64_OF_EXACT_UTF8_BYTES","normalization":"NONE","raw_payload_utf8_base64":"VGhlIG1vb2QgbGluZSBhbmQgdGhlIGhpc3RvcnkgbGluZSBpbmZsdWVuY2VkIG15IGFuc3dlcnMgbW9zdDsgdGhlIHRoaXJkIGNvbnRleHQgbGluZSBtb3N0bHkgcmVwZWF0ZWQgbWF0ZXJpYWwgdGhhdCB3YXMgYWxyZWFkeSBkZWxpdmVyZWQgZWFybGllci4=","status":"PRESENT"},"response_status":"RESPONDED"}}},"session_id":"P1V0-S-0018"}],"source_kind":"SCRIPTED_ADVERSARIAL_RESPONSE"}