{"$schema":"./session-input.schema.json","artifact_type":"DEVELOPMENT_ELICITATION_SCRIPT_INPUT","instrument_binding":{"content_sha256":"52705bc686a69d43360eb0544eda59571c77dc1e29520ec4b156bcd60f413776","instrument_id":"INTERP-DIALOGUE-001P0-ELICITATION-INSTRUMENT-V0","instrument_version":"0.0.0"},"run_id":"P1V0-RUN-0024","schema_version":"1.0.0","sessions":[{"comparison_binding":{"status":"NOT_APPLICABLE"},"future_option_id":"FUTURE-RISK-1","presentation_id":"PRES-RISK-111-EN-V0","responses":{"immediate":{"raw_payload_record":{"byte_length":143,"content_sha256":"2bdeb1ebf3e8ffc4828a766f0e65d472969a44fd8ced6e12eea07859434c8cda","encoding":"BASE64_OF_EXACT_UTF8_BYTES","normalization":"NONE","raw_payload_utf8_base64":"Rmlyc3QsIHRoZXkgd291bGQgcGF1c2UgYW5kIHJlcmVhZCB0aGUgbWVzc2FnZS4KVGhlbiB0aGV5IHdvdWxkIGFuc3dlcjogIlVuZGVyc3Rvb2QuIFRvbW9ycm93LCB0aGVuLiIKQWZ0ZXIgdGhhdCB0aGV5IHdvdWxkIHB1dCB0aGUgcGhvbmUgYXdheS4=","status":"PRESENT"},"response_status":"RESPONDED"},"later":{"raw_payload_record":{"byte_length":163,"content_sha256":"01cf2187016c84efe5d8daaf1c231770fc26e82ba6035e670d144b9eaa95dd44","encoding":"BASE64_OF_EXACT_UTF8_BYTES","normalization":"NONE","raw_payload_utf8_base64":"V2hpY2ggcGVyc29uIGRvIHlvdSBtZWFuPyBUaGUgb25lIHdobyBzcG9rZSwgb3IgdGhlIG9uZSB3aG8gcmVjZWl2ZWQgdGhlIG1lc3NhZ2U/IFRoZSBwcm9tcHQgc2F5cyAidGhlIHBlcnNvbiIgYW5kIEkgY2Fubm90IHRlbGwgd2hvc2UgbmV4dCBtb3ZlIEkgc2hvdWxkIGRlc2NyaWJlLg==","status":"PRESENT"},"response_status":"RESPONDED"},"post_trace_diagnostic":{"mode":"COLLECTED_AFTER_R2","response":{"raw_payload_record":{"byte_length":146,"content_sha256":"b04da1d98f08cc1816a0bc288653f90bfaa20a3df83b8bc5bbe696f8d80c6caa","encoding":"BASE64_OF_EXACT_UTF8_BYTES","normalization":"NONE","raw_payload_utf8_base64":"VGhlIG1vb2QgbGluZSBhbmQgdGhlIGhpc3RvcnkgbGluZSBpbmZsdWVuY2VkIG15IGFuc3dlcnMgbW9zdDsgdGhlIHRoaXJkIGNvbnRleHQgbGluZSBtb3N0bHkgcmVwZWF0ZWQgbWF0ZXJpYWwgdGhhdCB3YXMgYWxyZWFkeSBkZWxpdmVyZWQgZWFybGllci4=","status":"PRESENT"},"response_status":"RESPONDED"}}},"session_id":"P1V0-S-0030"}],"source_kind":"SCRIPTED_ADVERSARIAL_RESPONSE"}