{"$schema":"./session-input.schema.json","artifact_type":"DEVELOPMENT_ELICITATION_SCRIPT_INPUT","instrument_binding":{"content_sha256":"52705bc686a69d43360eb0544eda59571c77dc1e29520ec4b156bcd60f413776","instrument_id":"INTERP-DIALOGUE-001P0-ELICITATION-INSTRUMENT-V0","instrument_version":"0.0.0"},"run_id":"P1V0-RUN-0017","schema_version":"1.0.0","sessions":[{"comparison_binding":{"status":"NOT_APPLICABLE"},"future_option_id":"FUTURE-WORK-0","presentation_id":"PRES-WORK-110-EN-V0","responses":{"immediate":{"raw_payload_record":{"reason":"REFUSED","status":"ABSENT"},"response_status":"REFUSED"},"later":{"raw_payload_record":{"reason":"TECHNICAL_FAILURE","status":"ABSENT"},"response_status":"TECHNICAL_FAILURE"},"post_trace_diagnostic":{"mode":"OMITTED"}},"session_id":"P1V0-S-0023"}],"source_kind":"SCRIPTED_ADVERSARIAL_RESPONSE"}